{"version": 4,
 "unit": "ms",
 "weights": [10, 20],
 "start": "2026-10-25T09:00:00.000Z", "end": 100000000,
 "strings": [" Db.query", " GET /users/:id", " Json.write", " Server.handle", " Thread.run",
             " id=42", "#7", " socket timeout", " worker-1", "'2"],
 "stacks": [0, 32, 1, 24, 2, 2, 2, 17],
 "samples": {"time": [0, 10, 10, 0, 10, 20, 20],
             "stack": [0, 2, 3, 2, 2, -1, 0],
             "thread": [0, 0, 0, 1, 1, 1, 1],
             "operation": [-1, 0, 0, 1, 1, 1, -1],
             "kind": [0, 0, 0, 1, 0, 0, 0]},
 "threads": [[8, 21], [9, 22]],
 "operations": {"name": [1, 1],
                "start": [5000000, 7000000],
                "duration": [30000000, 50000000],
                "thread": [8, 9],
                "detail": [5, 6],
                "status": [200, 504],
                "failed": [0, 1],
                "error": [-1, 7],
                "async": [0, 0],
                "bytesIn": [120, 118],
                "bytesOut": [2048, 0]}}
